Name,MonType1,MonType2,MonType3,Tier,In Wishlist,Used,Trash,Useful_Attributes
Abomasnow,Grass,Ice,,RU,,,,"Grass, Ice, Iron Tail, Rock Slide, Earthquake, Earth Power, Shadow Ball"
Accelgor,Bug,,,RU,,,,"Bug, Water Shuriken, Sludge Bomb, Venoshock, Energy Ball, Knock Off"
Aerodactyl,Rock,,,RU,,,,"Rock, Aqua Tail, Iron Head, Ice Fang, Earthquake, Earth Power, Crunch, Payback"
Aggron,Steel,Rock,,RU,,Yes,,"Steel, Rock, Aqua Tail, Surf, Avalanche, Ice Punch, Ice Beam, Earthquake, Earth Power, Shadow Claw, Crunch, Payback, Dark Pulse, Payback"
Ambipom,,,,RU,,,,"Chilling Water, Iron Tail, Smack Down, Gunk Shot, Ice Punch, Triple Axel, Seed Bomb, Trailblaze, Grass Knot, Shadow Claw, Shadow Ball, Foul Play, Knock Off, Payback, Throat Chop, Payback, Beat Up, Uturn, Fury Cutter"
Amoonguss,Grass,Poison,,RU,,,,"Grass, Poison, Stomping Tantrum, Hex, Foul Play, Payback, Pollen Puff"
Ampharos,,,,RU,,,,"Iron Tail, Power Gem, Meteor Beam, Ice Punch, Stomping Tantrum, Signal Beam"
Appletun,Grass,,,RU,,,Yes,"Grass, Gyro Ball, Iron Head, Heavy Slam, Earthquake, Sucker Punch, Payback"
Araquanid,Water,Bug,,RU,,,,"Water, Bug, Poison Jab, Ice Beam, Aurora Beam, Giga Drain, Crunch"
Arbok,Poison,,,RU,,,,"Poison, Aqua Tail, Iron Tail, Rock Slide, Ice Fang, Earthquake, Mud Bomb, Seed Bomb, Giga Drain, Crunch, Knock Off, Sucker Punch, Payback, Dark Pulse, Throat Chop, Beat Up, Leech Life, Skitter Smack"
Arcanine,,,,RU,,,,"Iron Head, Iron Tail, Scorching Sands, Scorching Sands, Solar Beam, Crunch"
Arcanine-Hisui,,Rock,,RU,,,,"Rock, Iron Head, Smart Strike, Scorching Sands, Solar Beam, Crunch"
Archeops,Rock,,,RU,,,,"Rock, Aqua Tail, Iron Tail, Steel Wing, Earthquake, Earth Power, Shadow Claw, Crunch, Knock Off, Lash Out, Uturn"
Arctovish,Water,Ice,,RU,,,,"Water, Ice, Iron Head, Meteor Beam, Rock Slide, Stone Edge, Rock Blast, Crunch"
Arctozolt,,Ice,,RU,,,,"Ice, Hydro Pump, Surf, Iron Tail, Rock Slide, Stone Edge, Meteor Beam, Rock Blast, Stomping Tantrum, Payback"
Ariados,Bug,Poison,,RU,,,Yes,"Bug, Poison, Smart Strike, Stomping Tantrum, Stomping Tantrum, Solar Beam, Giga Drain, Shadow Sneak, Foul Play, Knock Off, Sucker Punch, Throat Chop, Night Slash"
Armaldo,Rock,Bug,,RU,,,,"Rock, Bug, Aqua Jet, Liquidation, Aqua Tail, Iron Tail, Cross Poison, Earthquake, Earth Power, Shadow Claw, Knock Off"
Armarouge,,,,RU,,,,"Flash Cannon, Meteor Beam, Scorching Sands, Energy Ball, Solar Beam, Shadow Ball, Dark Pulse"
Articuno,Ice,,,RU,,,,"Ice, Bubble Beam, Steel Wing, Signal Beam, Uturn"
Audino,,,,RU,,,,"Surf, Iron Tail, Ice Beam, Ice Punch, Stomping Tantrum, Grass Knot, Solar Beam, Shadow Ball, Knock Off, Throat Chop, Signal Beam"
Aurorus,Rock,Ice,,RU,,,,"Rock, Ice, Flash Cannon, Iron Head, Iron Tail, Earth Power, Earthquake, Dark Pulse"
Avalugg,Ice,,,RU,,,,"Ice, Gyro Ball, Heavy Slam, Iron Head, Flash Cannon, Rock Slide, Stone Edge, Earthquake, Crunch"
Avalugg-Hisui,Ice,Rock,,RU,,Yes,,"Ice, Rock, Surf, Gyro Ball, Heavy Slam, Iron Head, Flash Cannon, Earthquake, Crunch"
Azumarill,Water,,,RU,,,,"Water, Iron Tail, Ice Beam, Ice Spinner, Ice Punch, Grass Knot, Knock Off"
Barbaracle,Rock,Water,,RU,,,,"Rock, Water, Poison Jab, Sludge Bomb, Sludge Wave, Ice Beam, Earthquake, Grass Knot, Shadow Claw, Night Slash, Payback, Payback, Beat Up, X Scissor"
Barraskewda,Water,,,RU,,,,"Water, Poison Jab, Ice Fang, Ice Beam, Drill Run, Crunch, Throat Chop, Night Slash"
Bastiodon,Rock,Steel,,RU,Yes,,,"Rock, Steel, Avalanche, Ice Beam, Earthquake, Scorching Sands, Earth Power, Foul Play"
Beartic,Ice,,,RU,,Yes,,"Ice, Aqua Jet, Liquidation, Surf, Dive, Brine, Heavy Slam, Hard Press, Rock Slide, Stone Edge, Earthquake, Grass Knot, Shadow Claw, Crunch, Throat Chop, Night Slash, X Scissor"
Beedrill,Bug,Poison,,RU,,,,"Bug, Poison, Drill Run, Solar Beam, Knock Off, Throat Chop, Payback"
Beheeyem,,,,RU,Yes,,,"Flash Cannon, Steel Wing, Meteor Beam, Rock Slide, Energy Ball, Shadow Ball, Dark Pulse, Signal Beam"
Bewear,,,,RU,Yes,,,"Iron Head, Rock Slide, Ice Punch, Earthquake, Shadow Claw, Darkest Lairat, Payback"
Bibarel,,Water,,RU,,,Yes,"Water, Iron Tail, Ice Beam, Stomping Tantrum, Grass Knot, Shadow Ball, Crunch"
Blastoise,Water,,,RU,Yes,,,"Water, Flash Cannon, Iron Tail, Gyro Ball, Rock Slide, Ice Beam, Ice Spinner, Ice Punch, Avalanche, Earthquake, Crunch, Dark Pulse, Signal Beam"
Breloom,Grass,,,RU,,,,"Grass, Rock Slide, Stone Edge, Gunk Shot, Poison Jab, Sludge Bomb, Venoshock, Pounce"
Bronzong,Steel,,,RU,,,,"Steel, Power Gem, Rock Slide, Meteor Beam, Rock Blast, Ice Spinner, Earthquake, Grass Knot, Solar Beam, Shadow Ball, Hex, Payback, Signal Beam"
Brute Bonnet,Grass,Dark,,RU,,,,"Grass, Dark, Venoshock, Stomping Tantrum, Earth Power, Hex, Pollen Puff"
Bruxish,Water,,,RU,,,,"Water, Iron Tail, Poison Fang, Venoshock, Ice Fang, Ice Beam, Crunch, Payback, Signal Beam"
Cacturne,Grass,Dark,,RU,,,,"Grass, Dark, Poison Jab, Belch, Venoshock, Stomping Tantrum, Shadow Ball, Lunge, Pin Missile, Skitter Smack"
Camerupt,,Ground,,RU,,,,"Ground, Flash Cannon, Iron Head, Heavy Slam, Rock Slide, Stone Edge, Solar Beam, Lash Out"
Carracosta,Water,Rock,,RU,,,,"Water, Rock, Iron Head, Iron Tail, Ice Beam, Earthquake, Earth Power, Crunch, Knock Off"
Centiskorch,,Bug,,RU,,,,"Bug, Scald, Venoshock, Scorching Sands, Power Whip, Solar Beam, Crunch, Knock Off"
Cetitan,Ice,,,RU,,,,"Ice, Liquidation, Heavy Slam, Hard Press, Earthquake, Knock Off"
Charizard,,,,RU,,,,"Iron Tail, Rock Slide, Earthquake, Scorching Sands, Solar Beam, Shadow Claw, Crunch, Beat Up"
Chesnaught,Grass,,,RU,,,,"Grass, Iron Head, Gyro Ball, Iron Tail, Rock Slide, Stone Edge, Poison Jab, Earthquake, Shadow Claw, Crunch, Knock Off, Payback, Pin Missile"
Cinccino,,,,RU,,,,"Chilling Water, Iron Tail, Rock Blast, Gunk Shot, Ice Spinner, Triple Axel, Seed Bomb, Trailblaze, Bullet Seed, Grass Knot, Knock Off, Thief, Uturn"
Clawitzer,Water,,,RU,,,,"Water, Flash Cannon, Iron Tail, Rock Slide, Sludge Bomb, Sludge Wave, Venoshock, Ice Beam, Shadow Ball, Dark Pulse, Uturn"
Claydol,Ground,,,RU,,,,"Ground, Gyro Ball, Rock Slide, Stone Edge, Ice Beam, Grass Knot, Solar Beam, Hex, Shadow Ball, Signal Beam"
Cloyster,Water,Ice,,RU,,Yes,,"Water, Ice, Rock Blast, Poison Jab, Drill Run, Payback, Pin Missile, Signal Beam"
Copperajah,Steel,,,RU,,,,"Steel, Rock Slide, Stone Edge, Rock Blast, Belch, Earthquake, Earth Power, Power Whip, Knock Off, Payback"
Crabominable,,Ice,,RU,,,,"Ice, Crabhammer, Liquidation, Liquidation, Iron Head, Hard Press, Rock Slide, Stone Edge, Gunk Shot, Earthquake, Knock Off, Payback, Payback"
Cramorant,,Water,,RU,,,,"Water, Steel Wing, Belch, Ice Beam, Throat Chop"
Crawdaunt,Water,Dark,,RU,,,,"Water, Dark, Hard Press, Rock Slide, Sludge Bomb, Sludge Wave, Avalanche, Ice Beam, Lash Out, X Scissor"
Crustle,Bug,Rock,,RU,,,,"Bug, Rock, Heavy Slam, Poison Jab, Earthquake, Solar Beam, Solar Blade, Shadow Claw, Knock Off, Night Slash"
Cyclizar,,,,RU,,,,"Aqua Tail, Iron Head, Iron Tail, Ice Spinner, Power Whip, Crunch, Knock Off, Uturn"
Delcatty,,,,RU,,,,"Iron Tail, Ice Beam, Stomping Tantrum, Mud Bomb, Grass Knot, Solar Beam, Shadow Ball, Sucker Punch, Payback"
Delibird,Ice,,,RU,,,Yes,"Ice, Steel Wing, Gunk Shot, Drill Run, Seed Bomb, Foul Play"
Delphox,,,,RU,,,,"Iron Tail, Scorching Sands, Grass Knot, Solar Beam, Shadow Ball, Hex, Foul Play, Signal Beam"
Deoxys-Defense,,,,RU,,,,"Meteor Mash, Flash Cannon, Meteor Beam, Rock Slide, Poison Jab, Ice Beam, Ice Punch, Stomping Tantrum, Grass Knot, Solar Beam, Energy Ball, Shadow Ball, Dark Pulse, Throat Chop, Knock Off, Signal Beam"
Dewgong,Water,Ice,,RU,,,,"Water, Ice, Iron Tail, Smart Strike, Belch, Drill Run, Knock Off, Megahorn, Signal Beam"
Dhelmise,Ghost,Grass,Steel,RU,,,,"Ghost, Grass, Steel, Hydro Pump, Liquidation, Surf, Brine, Gyro Ball, Heavy Slam, Iron Head, Rock Slide, Sludge Wave, Knock Off, Payback"
Diggersby,,Ground,,RU,,,,"Ground, Surf, Iron Tail, Iron Head, Stone Edge, Rock Slide, Gunk Shot, Sludge Bomb, Ice Punch, Grass Knot, Foul Play, Knock Off, Payback, Uturn"
Donphan,Ground,,,RU,,Yes,,"Ground, Gyro Ball, Heavy Slam, Iron Tail, Iron Head, Smart Strike, Head Smash, Stone Edge, Rock Slide, Gunk Shot, Poison Jab, Ice Spinner, Ice Fang, Ice Shard, Seed Bomb, Throat Chop, Knock Off, Assurance"
Dragalge,Poison,,,RU,,,,"Poison, Hydro Pump, Liquidation, Aqua Tail, Surf, Muddy Water, Scald, Waterfall, Dive, Flip Turn, Iron Tail, Shadow Ball"
Drampa,,,,RU,,,,"Hydro Pump, Surf, Steel Wing, Rock Slide, Ice Beam, Earthquake, Grass Knot, Solar Beam, Energy Ball, Shadow Ball, Shadow Claw, Lash Out"
Drapion,Poison,Dark,,RU,,,,"Poison, Dark, Aqua Tail, Iron Tail, Rock Slide, Ice Fang, Earthquake, Shadow Ball, Bug Buzz, X Scissor, Skitter Smack, Pin Missile"
Drednaw,Water,Rock,,RU,,,,"Water, Rock, Smart Strike, Poison Jab, Ice Beam, Ice Spinner, Ice Fang, Earthquake, Earth Power, Crunch, Throat Chop, Jaw Lock, Payback, Megahorn, Skitter Smack"
Druddigon,,,,RU,,,,"Aqua Tail, Surf, Iron Tail, Flash Cannon, Iron Head, Rock Slide, Gunk Shot, Sludge Bomb, Earthquake, Shadow Claw, Crunch, Dark Pulse, Lash Out, Sucker Punch, Night Slash, Payback"
Dudunsparce,,,,RU,,,,"Aqua Tail, Gyro Ball, Heavy Slam, Iron Tail, Smart Strike, Rock Slide, Poison Jab, Ice Beam, Ice Spinner, Earthquake, Earth Power, Drill Run, Solar Beam, Shadow Ball, Hex, Throat Chop, Lunge, Skitter Smack"
Duraludon,Steel,,,RU,,,,"Steel, Stone Edge, Rock Slide, Stomping Tantrum, Solar Beam, Foul Play, Dark Pulse, Night Slash"
Durant,Bug,Steel,,RU,,,,"Bug, Steel, Stone Edge, Rock Slide, Stomping Tantrum, Energy Ball, Shadow Claw, Crunch, Beat Up, Skitter Smack"
Dusknoir,Ghost,,,RU,,,,"Ghost, Hard Press, Rock Slide, Ice Beam, Ice Punch, Darkest Lairat, Dark Pulse, Sucker Punch, Payback, Leech Life, Skitter Smack"
Eelektross,,,,RU,,,,"Aqua Tail, Liquidation, Heavy Slam, Iron Tail, Flash Cannon, Rock Slide, Stomping Tantrum, Grass Knot, Giga Drain, Hex, Crunch, Throat Chop, Knock Off, Lunge, Signal Beam, Uturn"
Electivire,,,,RU,,,,"Iron Tail, Rock Slide, Ice Punch, Earthquake, Darkest Lairat, Knock Off, Signal Beam"
Emboar,,,,RU,,,,"Scald, Hard Press, Gyro Ball, Heavy Slam, Iron Tail, Iron Head, Head Smash, Stone Edge, Rock Slide, Poison Jab, Earthquake, Grass Knot, Solar Beam, Sucker Punch, Knock Off"
Empoleon,Water,Steel,,RU,,Yes,,"Water, Steel, Rock Slide, Ice Beam, Ice Spinner, Avalanche, Triple Axel, Earthquake, Grass Knot, Shadow Claw, Throat Chop, Lash Out, Knock Off, Power Trip, Signal Beam"
Entei,,,,RU,,,,"Iron Tail, Iron Head, Stone Edge, Stomping Tantrum, Scorching Sands, Solar Beam, Shadow Ball, Crunch"
Escavalier,Bug,Steel,,RU,,,,"Bug, Steel, Razor Shell, Poison Jab, Drill Run, Energy Ball, Giga Drain, Night Slash, Knock Off"
Espeon,,,,RU,,,,"Iron Tail, Power Gem, Grass Knot, Shadow Ball, Signal Beam"
Exeggutor-Alola,Grass,,,RU,,,,"Grass, Iron Head, Sludge Bomb, Earthquake, Knock Off"
Farigiraf,,,,RU,,,,"Iron Tail, Iron Head, Earthquake, Grass Knot, Energy Ball, Shadow Ball, Foul Play, Crunch, Sucker Punch, Beat Up, Signal Beam"
Feraligatr,Water,,,RU,,,,"Water, Iron Tail, Rock Slide, Ice Beam, Ice Punch, Ice Fang, Avalanche, Earthquake, Shadow Claw, Crunch, Lash Out"
Floatzel,Water,,,RU,,,,"Water, Iron Tail, Ice Beam, Ice Spinner, Ice Punch, Ice Fang, Crunch, Payback"
Flygon,Ground,,,RU,,Yes,,"Ground, Iron Tail, Steel Wing, Stone Edge, Rock Slide, Earthquake, Solar Beam, Giga Drain, Crunch, Throat Chop, Bug Buzz, First Impression, Signal Beam, Uturn"
Forretress,Bug,Steel,,RU,,,,"Bug, Steel, Stone Edge, Rock Slide, Poison Jab, Venoshock, Ice Spinner, Earthquake, Earth Power, Drill Run, Solar Beam, Seed Bomb, Giga Drain"
Furfrou,,,,RU,,,,"Surf, Iron Tail, Grass Knot, Dark Pulse, Sucker Punch, Uturn"
Furret,,,,RU,,,,"Aqua Tail, Surf, Iron Tail, Ice Beam, Ice Punch, Grass Knot, Solar Beam, Seed Bomb, Shadow Ball, Shadow Claw, Sucker Punch, Knock Off, Uturn"
Gallade,,,,RU,,,,"Aqua Cutter, Stone Edge, Rock Slide, Poison Jab, Ice Punch, Triple Axel, Earthquake, Solar Blade, Grass Knot, Energy Ball, Leaf Blade, Shadow Ball, Shadow Claw, Hex, Shadow Sneak, Throat Chop, Night Slash, Knock Off, X Scissor, Signal Beam"
Garbodor,Poison,,,RU,,,,"Poison, Rock Blast, Stomping Tantrum, Solar Beam, Seed Bomb, Giga Drain, Dark Pulse, Payback"
Gastrodon,Water,Ground,,RU,,Yes,,"Water, Ground, Stone Edge, Rock Slide, Rock Blast, Sludge Wave, Sludge Bomb, Sludge, Ice Beam, Earth Power, Skitter Smack"
Gigalith,Rock,,,RU,,,,"Rock, Heavy Slam, Flash Cannon, Iron Head, Earthquake, Earth Power, Solar Beam, Throat Chop"
Glaceon,Ice,,,RU,,,,"Ice, Aqua Tail, Iron Tail, Shadow Ball, Signal Beam"
Glalie,Ice,,,RU,,,,"Ice, Gyro Ball, Iron Head, Earthquake, Shadow Ball, Hex, Foul Play, Crunch, Dark Pulse, Payback, Signal Beam"
Gogoat,Grass,,,RU,,,,"Grass, Surf, Iron Tail, Rock Slide, Earthquake, Throat Chop, Payback"
Golduck,Water,,,RU,,,,"Water, Iron Tail, Power Gem, Ice Beam, Ice Punch, Mud Bomb, Grass Knot, Shadow Claw, Knock Off, Signal Beam"
Golisopod,Bug,Water,,RU,,,,"Bug, Water, Iron Head, Rock Slide, Sludge Wave, Sludge Bomb, Poison Jab, Venoshock, Ice Beam, Drill Run, Shadow Claw, Dark Pulse, Throat Chop, Sucker Punch, Knock Off, Payback"
Golurk,Ground,Ghost,,RU,,,,"Ground, Ghost, Hard Press, Gyro Ball, Heavy Slam, Flash Cannon, Stone Edge, Rock Slide, Ice Beam, Ice Punch, Grass Knot, Solar Beam, Darkest Lairat, Knock Off, Signal Beam"
Goodra,,,,RU,,Yes,,"Hydro Pump, Aqua Tail, Surf, Muddy Water, Scald, Iron Tail, Rock Slide, Sludge Wave, Sludge Bomb, Ice Beam, Earthquake, Power Whip, Knock Off, Skitter Smack"
Gourgeist,Ghost,Grass,,RU,,,,"Ghost, Grass, Gyro Ball, Rock Slide, Sludge Bomb, Foul Play, Dark Pulse, Skitter Smack"
Granbull,,,,RU,,Yes,,"Iron Tail, Stone Edge, Rock Slide, Sludge Bomb, Ice Punch, Ice Fang, Earthquake, Solar Beam, Shadow Ball, Crunch, Lash Out, Payback"
Greedent,,,,RU,,,,"Gyro Ball, Iron Tail, Belch, Ice Fang, Earthquake, Seed Bomb, Bullet Seed, Crunch, Knock Off, Payback"
Grumpig,,,,RU,,,,"Iron Tail, Flash Cannon, Power Gem, Belch, Ice Punch, Earth Power, Stomping Tantrum, Grass Knot, Energy Ball, Seed Bomb, Shadow Ball, Payback, Lunge, Signal Beam"
Gumshoos,,,,RU,,,,"Iron Tail, Iron Head, Ice Punch, Ice Fang, Earthquake, Seed Bomb, Crunch, Knock Off, Payback, Uturn"
Hariyama,,,,RU,,,,"Surf, Brine, Heavy Slam, Iron Head, Bullet Punch, Stone Edge, Rock Slide, Poison Jab, Ice Punch, Headlong Rush, Earthquake, Throat Chop, Lash Out, Knock Off, Payback"
Heatmor,,,,RU,,,,"Belch, Stomping Tantrum, Scorching Sands, Solar Beam, Giga Drain, Shadow Claw, Throat Chop, Sucker Punch, Night Slash, Knock Off"
Heliolisk,,,,RU,,,,"Surf, Iron Tail, Rock Slide, Grass Knot, Solar Beam, Dark Pulse, Signal Beam, Uturn"
Heracross,Bug,,,RU,,,,"Bug, Smart Strike, Stone Edge, Rock Slide, Rock Blast, Venoshock, Earthquake, Bullet Seed, Shadow Claw, Throat Chop, Night Slash, Knock Off"
Hitmonchan,,,,RU,,,,"Bullet Punch, Stone Edge, Rock Slide, Poison Jab, Ice Punch, Earthquake, Throat Chop, Knock Off"
Hitmontop,,,,RU,,,,"Gyro Ball, Bullet Punch, Stone Edge, Rock Slide, Ice Spinner, Triple Axel, Earthquake, Drill Run, Sucker Punch, Brutal Swing, Thief"
Infernape,,,,RU,,,,"Iron Tail, Stone Edge, Rock Slide, Gunk Shot, Poison Jab, Earthquake, Scorching Sands, Grass Knot, Solar Beam, Shadow Claw, Throat Chop, Lash Out, Knock Off, Uturn"
Iron Jugulis,Dark,,,RU,,,,"Dark, Hydro Pump, Flash Cannon, Iron Head, Meteor Beam, Earth Power, Uturn"
Iron Thorns,Rock,,,RU,,,,"Rock, Heavy Slam, Iron Head, Ice Beam, Ice Punch, Ice Fang, Earthquake, Earth Power, Crunch, Pin Missile"
Jellicent,Water,Ghost,,RU,,,,"Water, Ghost, Sludge Wave, Sludge Bomb, Ice Beam, Energy Ball, Giga Drain, Dark Pulse"
Kabutops,Rock,Water,,RU,,,,"Rock, Water, Cross Poison, Ice Beam, Aurora Beam, Earth Power, Giga Drain, Night Slash, Knock Off, Leech Life, X Scissor"
Kangaskhan,,,,RU,,,,"Aqua Tail, Surf, Bubble Beam, Hydro Pump, Iron Tail, Rock Slide, Ice Beam, Ice Punch, Avalanche, Earthquake, Solar Beam, Shadow Ball, Shadow Claw, Crunch, Sucker Punch, Beat Up"
Kecleon,,,,RU,,,,"Aqua Tail, Iron Tail, Rock Slide, Ice Beam, Ice Punch, Grass Knot, Solar Beam, Shadow Ball, Shadow Claw, Shadow Sneak, Foul Play, Sucker Punch, Knock Off"
Kingdra,Water,,,RU,,,,"Water, Flash Cannon, Iron Head, Ice Beam, Aurora Beam, Signal Beam"
Komala,,,,RU,,,,"Iron Head, Rock Slide, Gunk Shot, Ice Spinner, Earthquake, Wood Hammer, Seed Bomb, Shadow Claw, Sucker Punch, Knock Off, Payback, Uturn"
Krookodile,Ground,Dark,,RU,,,,"Ground, Dark, Aqua Tail, Iron Tail, Stone Edge, Rock Slide, Gunk Shot, Sludge Bomb, Grass Knot, Shadow Claw, Foul Play, Skitter Smack"
Lapras,Water,Ice,,RU,,,,"Water, Ice, Iron Tail, Smart Strike, Iron Head, Earthquake, Drill Run, Solar Beam, Megahorn, Signal Beam"
Latias,,,,RU,,,,"Surf, Liquidation, Waterfall, Dive, Steel Wing, Ice Beam, Earthquake, Grass Knot, Solar Beam, Energy Ball, Shadow Ball, Shadow Claw, Sucker Punch"
Lickilicky,,,,RU,,,,"Hydro Pump, Aqua Tail, Surf, Muddy Water, Bubble Beam, Gyro Ball, Iron Tail, Rock Slide, Belch, Ice Beam, Ice Punch, Earthquake, Stomping Tantrum, Power Whip, Solar Beam, Shadow Ball, Knock Off"
Linoone,,,,RU,Yes,,,"Surf, Iron Tail, Gunk Shot, Ice Beam, Stomping Tantrum, Grass Knot, Seed Bomb, Shadow Ball, Shadow Claw, Throat Chop, Pin Missile"
Lucario,,Steel,,RU,,,,"Steel, Stone Edge, Rock Slide, Poison Jab, Ice Punch, Earthquake, Bone Rush, Shadow Ball, Shadow Claw, Crunch, Dark Pulse, Payback"
Lunatone,Rock,,,RU,,,,"Rock, Gyro Ball, Iron Head, Ice Beam, Earthquake, Earth Power, Grass Knot, Shadow Ball, Signal Beam"
Machamp,,,,RU,,,,"Heavy Slam, Bullet Punch, Stone Edge, Rock Slide, Rock Blast, Poison Jab, Cross Poison, Ice Punch, Earthquake, Darkest Lairat, Throat Chop, Knock Off, Payback"
Magmortar,,,,RU,,Yes,,"Iron Tail, Rock Slide, Belch, Poison Jab, Earthquake, Scorching Sands, Solar Beam, Knock Off"
Mantine,Water,,,RU,,,,"Water, Iron Head, Rock Slide, Rock Blast, Gunk Shot, Ice Beam, Earthquake, Seed Bomb, Bullet Seed, Signal Beam"
Marowak,Ground,,,RU,,,,"Ground, Bubble Beam, Iron Tail, Iron Head, Stone Edge, Rock Slide, Ice Beam, Throat Chop, Knock Off"
Marowak-Alola,,Ghost,,RU,,,,"Ghost, Iron Tail, Iron Head, Stone Edge, Rock Slide, Ice Beam, Earthquake, Earth Power, Scorching Sands, Bone Club, Bonemerang, Bone Rush, Dark Pulse, Throat Chop, Knock Off"
Mawile,Steel,,,RU,,,,"Steel, Stone Edge, Rock Slide, Sludge Bomb, Ice Beam, Ice Punch, Ice Fang, Grass Knot, Solar Beam, Shadow Ball, Foul Play, Crunch, Dark Pulse, Sucker Punch, Knock Off, Payback"
Medicham,,,,RU,,Yes,,"Rock Slide, Poison Jab, Ice Punch, Grass Knot, Energy Ball, Shadow Ball, Signal Beam"
Meganium,Grass,,,RU,,,,"Grass, Iron Tail, Earthquake, Knock Off"
Metagross,Steel,,,RU,,Yes,,"Steel, Meteor Beam, Stone Edge, Rock Slide, Sludge Bomb, Ice Punch, Earthquake, Grass Knot, Shadow Ball, Shadow Claw, Knock Off, Signal Beam"
Milotic,Water,,,RU,,,,"Water, Iron Head, Ice Beam, Avalanche, Triple Axel, Skitter Smack"
Miltank,,,,RU,,,,"Surf, Gyro Ball, Heavy Slam, Iron Tail, Iron Head, Rock Slide, Belch, Ice Beam, Ice Punch, Earthquake, Solar Beam, Shadow Ball"
Minior,Rock,,,RU,,,,"Rock, Gyro Ball, Iron Head, Earthquake, Earth Power, Scorching Sands, Solar Beam, Uturn"
Muk,Poison,,,RU,,,,"Poison, Rock Slide, Ice Punch, Mud Bomb, Giga Drain, Shadow Ball, Hex, Shadow Sneak, Dark Pulse, Lash Out, Knock Off, Payback"
Muk-Alola,Poison,Dark,,RU,,Yes,,"Poison, Dark, Stone Edge, Rock Slide, Ice Punch, Giga Drain, Shadow Ball, Hex, Shadow Sneak"
Musharna,,,,RU,,,,"Gyro Ball, Rock Slide, Energy Ball, Shadow Ball, Signal Beam"
Necrozma,,,,RU,,,,"Flash Cannon, Iron Head, Smart Strike, Meteor Beam, Stone Edge, Power Gem, Rock Slide, Rock Blast, Earthquake, Earth Power, Solar Beam, Shadow Claw, Dark Pulse, Night Slash, Knock Off, X Scissor, Signal Beam"
Nidoking,Poison,Ground,,RU,,,,"Poison, Ground, Aqua Tail, Surf, Bubble Beam, Iron Tail, Smart Strike, Head Smash, Stone Edge, Rock Slide, Rock Blast, Ice Beam, Ice Punch, Avalanche, Shadow Ball, Shadow Claw, Hex, Throat Chop, Sucker Punch, Megahorn"
Nidoqueen,Poison,Ground,,RU,,,,"Poison, Ground, Aqua Tail, Surf, Bubble Beam, Iron Tail, Stone Edge, Rock Slide, Rock Blast, Ice Beam, Ice Punch, Avalanche, Shadow Ball, Shadow Claw, Hex, Crunch, Throat Chop, Sucker Punch, Beat Up"
Nihilego,Rock,Poison,,RU,,,,"Rock, Poison, Iron Head, Grass Knot, Hex, Foul Play, Knock Off"
Ninetales,,,,RU,,,,"Iron Tail, Scorching Sands, Solar Beam, Energy Ball, Shadow Ball, Hex, Foul Play, Dark Pulse, Payback"
Obstagoon,Dark,,,RU,,,,"Dark, Surf, Iron Tail, Gunk Shot, Cross Poison, Ice Beam, Ice Punch, Stomping Tantrum, Grass Knot, Seed Bomb, Shadow Ball, Shadow Claw, X Scissor, Pin Missile"
Octillery,Water,,,RU,,,,"Water, Flash Cannon, Rock Blast, Gunk Shot, Sludge Wave, Ice Beam, Aurora Beam, Energy Ball, Seed Bomb, Bullet Seed, Payback, Signal Beam, Skitter Smack"
Oinkologne,,,,RU,,,,"Iron Head, Belch, High Horsepower, Earth Power, Stomping Tantrum, Energy Ball, Seed Bomb, Bullet Seed, Lash Out"
Oinkologne-F,,,,RU,,,,"Iron Head, Belch, High Horsepower, Earth Power, Stomping Tantrum, Energy Ball, Seed Bomb, Bullet Seed, Lash Out"
Okidogi,Poison,,,RU,,,,"Poison, Hard Press, Iron Head, Ice Punch, Ice Fang, High Horsepower, Stomping Tantrum, Shadow Claw, Crunch, Throat Chop, Lash Out, Knock Off"
Omastar,Rock,Water,,RU,,,,"Rock, Water, Gyro Ball, Ice Beam, Aurora Beam, Earth Power, Crunch, Knock Off, Pin Missile"
Overqwil,Dark,Poison,,RU,,,,"Dark, Poison, Aqua Tail, Surf, Liquidation, Waterfall, Brine, Bubble Beam, Aqua Jet, Hydro Pump, Gyro Ball, Smart Strike, Ice Beam, Shadow Ball, Hex, Pin Missile"
Palossand,Ghost,Ground,,RU,,,,"Ghost, Ground, Brine, Flash Cannon, Stone Edge, Rock Slide, Sludge Bomb, Energy Ball, Giga Drain"
Pangoro,,Dark,,RU,,,,"Dark, Surf, Iron Head, Stone Edge, Rock Slide, Gunk Shot, Sludge Bomb, Poison Jab, Ice Punch, Earthquake, Grass Knot, Shadow Claw, X Scissor"
Passimian,,,,RU,,,,"Gyro Ball, Iron Tail, Iron Head, Rock Slide, Gunk Shot, Earthquake, Grass Knot, Energy Ball, Seed Bomb, Shadow Ball, Knock Off, Payback, Beat Up, Uturn"
Pelipper,Water,,,RU,,,,"Water, Steel Wing, Gunk Shot, Ice Beam, Seed Bomb, Knock Off, Payback, Uturn"
Persian,,,,RU,,,,"Bubble Beam, Iron Tail, Power Gem, Gunk Shot, Petal Dance, Seed Bomb, Shadow Ball, Shadow Claw, Foul Play, Dark Pulse, Throat Chop, Lash Out, Night Slash, Knock Off, Payback, Uturn, Skitter Smack"
Persian-Alola,Dark,,,RU,,,,"Dark, Iron Tail, Power Gem, Gunk Shot, Seed Bomb, Shadow Ball, Shadow Claw, Uturn, Skitter Smack"
Pikachu,,,,RU,,,,"Surf, Iron Tail, Grass Knot, Knock Off, Signal Beam"
Pincurchin,,,,RU,,,,"Hydro Pump, Surf, Muddy Water, Liquidation, Scald, Brine, Bubble Beam, Poison Jab, Venoshock, Hex, Throat Chop, Sucker Punch, Payback, Pin Missile"
Poliwrath,Water,,,RU,,,,"Water, Rock Slide, Poison Jab, Ice Beam, Ice Punch, Earthquake, Earth Power, Mud Bomb, Darkest Lairat, Throat Chop, Knock Off, Payback"
Primarina,Water,,,RU,,,,"Water, Iron Tail, Ice Beam, Ice Spinner, Triple Axel, Energy Ball, Shadow Ball"
Qwilfish,Water,Poison,,RU,,,,"Water, Poison, Gyro Ball, Ice Beam, Shadow Ball, Hex, Crunch, Throat Chop, Payback, Signal Beam, Pin Missile"
Rabsca,Bug,,,RU,,,,"Bug, Power Gem, Gunk Shot, Sludge Bomb, Earth Power, Energy Ball, Poltergeist, Shadow Ball"
Raichu,,,,RU,,,,"Surf, Iron Tail, Grass Knot, Knock Off, Signal Beam"
Raichu-Alola,,,,RU,,,,"Surf, Iron Tail, Grass Knot, Knock Off, Signal Beam"
Raikou,,,,RU,,,,"Scald, Iron Tail, Iron Head, Shadow Ball, Crunch, Throat Chop, Signal Beam"
Ramparados,Rock,,,RU,,,,"Rock, Surf, Heavy Slam, Iron Tail, Iron Head, Rock Slide, Ice Beam, Avalanche, Earthquake, Earth Power, Crunch, Payback"
Rapidash,,,,RU,,,,"Iron Tail, Smart Strike, Poison Jab, High Horsepower, Drill Run, Scorching Sands, Solar Blade, Solar Beam, Throat Chop, Megahorn"
Raticate,,,,RU,,,,"Bubble Beam, Iron Tail, Ice Beam, Stomping Tantrum, Grass Knot, Shadow Ball, Crunch, Throat Chop, Sucker Punch, Uturn"
Raticate-Alola,Dark,,,RU,,,,"Dark, Iron Tail, Sludge Wave, Sludge Bomb, Venoshock, Ice Beam, Stomping Tantrum, Grass Knot, Shadow Ball, Shadow Claw, Sucker Punch, Uturn"
Regice,Ice,,,RU,,,,"Ice, Heavy Slam, Flash Cannon, Iron Head, Rock Slide, Earthquake, Signal Beam"
Regigigas,,,,RU,Yes,,,"Hard Press, Heavy Slam, Iron Head, Stone Edge, Rock Slide, Ice Punch, Avalanche, Earthquake, Earth Power, Darkest Lairat, Knock Off, Payback"
Registeel,Steel,,,RU,Yes,,,"Steel, Meteor Beam, Rock Slide, Ice Spinner, Ice Punch, Earthquake, Shadow Claw"
Reuniclus,,,,RU,,,,"Gyro Ball, Flash Cannon, Rock Slide, Ice Punch, Grass Knot, Energy Ball, Shadow Ball, Knock Off, Signal Beam"
Rhyperior,Ground,Rock,,RU,,,,"Ground, Rock, Hydro Pump, Aqua Tail, Surf, Bubble Beam, Heavy Slam, Iron Tail, Flash Cannon, Iron Head, Smart Strike, Poison Jab, Ice Beam, Ice Punch, Ice Fang, Avalanche, Shadow Claw, Crunch, Payback, Megahorn"
Sableye,Dark,Ghost,,RU,,,,"Dark, Ghost, Octazooka, Gyro Ball, Power Gem, Poison Jab, Ice Punch, Energy Ball, Giga Drain, Dark Pulse, X Scissor, Signal Beam, Skitter Smack"
Samurott,Water,,,RU,,,,"Water, Iron Tail, Smart Strike, Ice Beam, Avalanche, Drill Run, Grass Knot, Night Slash, Knock Off, Megahorn, X Scissor"
Sandslash-Alola,Ice,Steel,,RU,,,,"Ice, Steel, Aqua Tail, Rock Slide, Poison Jab, Earthquake, Drill Run, Shadow Claw, Throat Chop, Night Slash, Knock Off, Leech Life, X Scissor, Pin Missile"
Sawk,,,,RU,,,,"Stone Edge, Rock Slide, Poison Jab, Ice Punch, Earthquake, Grass Knot, Throat Chop, Knock Off, Payback"
Sawsbuck,,Grass,,RU,,,,"Grass, Smart Strike, High Horsepower, Shadow Ball, Throat Chop, Megahorn"
Sceptile,Grass,,,RU,,,,"Grass, Iron Tail, Rock Slide, Cross Poison, Earthquake, Crunch, Throat Chop, Night Slash, X Scissor"
Scrafty,Dark,,,RU,,,,"Dark, Iron Tail, Iron Head, Head Smash, Stone Edge, Rock Slide, Sludge Bomb, Poison Jab, Ice Punch, Grass Knot"
Scream Tail,,,,RU,,,,"Gyro Ball, Ice Beam, Ice Punch, Ice Fang, Stomping Tantrum, Grass Knot, Crunch"
