Name,MonType1,MonType2,MonType3,Tier,In Wishlist,Used,Trash,Useful_Attributes
Abomasnow,,Ice,,RU,,,,"Ice, Earthquake, Earth Power, Rock Slide, Outrage"
Aerodactyl,Rock,,,RU,,,,"Rock, Aqua Tail, Dragon Claw, Earthquake, Ice Fang, Thunder Fang, Dragon Pulse, Earth Power"
Aggron,,Rock,,RU,,Yes,,"Rock, Aqua Tail, Avalanche, Dragon Claw, Earthquake, Ice Punch, Outrage, Thunder Punch, Dragon Pulse, Earth Power, Ice Beam, Surf, Dragon Rush"
Altaria,Dragon,,Fairy,RU,,,,"Dragon, Fairy, Alluring Voice, Earthquake, Ice Beam, Moonblast, Play Rough, Dazzling Gleam"
Ampharos,Electric,,Dragon,RU,,,,"Electric, Dragon, Dazzling Gleam, Dragon Pulse, Power Gem, Ice Punch, Meteor Beam, Stomping Tantrum, Breaking Swipe"
Arbok,,,,RU,,,,"Aqua Tail, Earthquake, Ice Fang, Rock Slide, Scale Shot, Breaking Swipe, Thunder Fang, Breaking Swipe, Mud Bomb"
Arcanine,,,,RU,,,,"Outrage, Play Rough, Wild Charge, Scorching Sands, Thunder Fang, Dragon Pulse, Scorching Sands"
Arcanine-Hisui,,Rock,,RU,,,,"Rock, Outrage, Wild Charge, Thunder Fang, Dragon Pulse, Scorching Sands"
Archeops,Rock,,,RU,,,,"Rock, Aqua Tail, Dragon Claw, Earthquake, Outrage, Earth Power, Dragon Pulse"
Arctozolt,Electric,Ice,,RU,,,,"Electric, Ice, Freeze Dry, Rock Slide, Stone Edge, Meteor Beam, Hydro Pump, Surf, Stomping Tantrum, Rock Blast"
Armaldo,Rock,,,RU,,,,"Rock, Aqua Jet, Earthquake, Liquidation, Aqua Tail, Earth Power"
Armarouge,,,,RU,,,,"Dragon Pulse, Meteor Beam, Scorching Sands"
Audino,,,Fairy,RU,,,,"Fairy, Dazzling Gleam, Ice Beam, Stomping Tantrum, Surf, Thunder Punch, Wild Charge, Ice Punch"
Aurorus,Rock,Ice,,RU,,,,"Rock, Ice, Freeze Dry, Discharge, Earth Power, Earthquake"
Avalugg,Ice,,,RU,,,,"Ice, Earthquake, Rock Slide, Stone Edge"
Avalugg-Hisui,Ice,Rock,,RU,,Yes,,"Ice, Rock, Earthquake, Surf"
Barbaracle,Rock,Water,,RU,,,,"Rock, Water, Dragon Claw, Earthquake, Ice Beam, Dual Chop"
Barraskewda,Water,,,RU,,,,"Water, Drill Run, Ice Fang, Scale Shot, Ice Beam"
Bastiodon,Rock,,,RU,Yes,,,"Rock, Avalanche, Earthquake, Ice Beam, Scorching Sands, Outrage, Earth Power"
Beartic,Ice,,,RU,,Yes,,"Ice, Aqua Jet, Earthquake, Liquidation, Play Rough, Rock Slide, Stone Edge, Surf, Dive, Brine"
Bewear,,,,RU,Yes,,,"Dragon Claw, Earthquake, Ice Punch, Rock Slide, Thunder Punch, Dual Chop"
Bibarel,,Water,,RU,,,Yes,"Water, Stomping Tantrum, Ice Beam"
Blastoise,Water,,,RU,Yes,,,"Water, Dragon Pulse, Earthquake, Ice Beam, Ice Spinner, Outrage, Rock Slide, Ice Punch, Avalanche"
Blissey,,,,RU,,,,"Alluring Voice, Ice Beam, Bubble Beam, Mud Bomb"
Bombirdier,,,Rock,RU,Yes,,,"Rock, Drill Run, Rock Slide, Stone Edge, Power Gem"
Bouffalant,,,,RU,,,,"Earthquake, Outrage, Rock Slide, Stone Edge, Wild Charge"
Bronzong,,,,RU,,,,"Earthquake, Ice Spinner, Power Gem, Rock Slide, Meteor Beam, Rock Blast"
Cacturne,,,,RU,,,,"Stomping Tantrum, Thunder Punch"
Camerupt,,Ground,,RU,,,,"Ground, Rock Slide, Stone Edge"
Carbink,Rock,Fairy,,RU,Yes,,,"Rock, Fairy, Earth Power"
Carracosta,Water,Rock,,RU,,,,"Water, Rock, Earthquake, Ice Beam, Earth Power"
Centiskorch,,,,RU,,,,"Scald, Scorching Sands, Thunder Fang"
Cetitan,Ice,,,RU,,,,"Ice, Earthquake, Play Rough, Liquidation"
Charizard,,,Dragon,RU,,,,"Dragon, Dragon Claw, Earthquake, Outrage, Rock Slide, Thunder Punch, Dragon Pulse, Outrage, Scorching Sands, Breaking Swipe, Dragon Rush, Scale Shot"
Chesnaught,,,,RU,,,,"Dragon Claw, Earthquake, Rock Slide, Stone Edge, Thunder Punch, Dual Chop"
Claydol,Ground,,,RU,,,,"Ground, Dazzling Gleam, Ice Beam, Rock Slide, Stone Edge"
Cloyster,Water,Ice,,RU,,Yes,,"Water, Ice, Drill Run, Rock Blast"
Coalossal,Rock,,,RU,,,,"Rock, Earthquake, Earth Power, Scorching Sands, Scald"
Copperajah,,,,RU,,,,"Earthquake, Outrage, Play Rough, Rock Slide, Stone Edge, Supercell Slam, Earth Power, Rock Blast"
Corsola,Water,Rock,,RU,,,,"Water, Rock, Earth Power, Earthquake, Ice Beam, Icicle Spear"
Corsola-Galar,,,,RU,,,,"Meteor Beam, Head Smash, Hydro Pump, Ice Beam, Earthquake, Earth Power, Stone Edge, Surf, Liquidation, Power Gem, Scald, Brine, Icicle Spear, Rock Blast"
Crabominable,,Ice,,RU,,,,"Ice, Crabhammer, Earthquake, Liquidation, Rock Slide, Stone Edge, Thunder Punch, Liquidation"
Cradily,Rock,,,RU,,,,"Rock, Earth Power, Earthquake, Brine"
Crustle,,Rock,,RU,,,,"Rock, Earthquake"
Cursola,,,,RU,,,,"Earth Power, Hydro Pump, Ice Beam, Meteor Beam, Power Gem, Scald, Head Smash, Earthquake, Stone Edge, Surf, Liquidation, Rock Slide, Brine, Icicle Spear, Rock Blast"
Dachsbun,Fairy,,,RU,,,,"Fairy, Ice Fang, Stomping Tantrum, Thunder Fang"
Darmanitan,,,,RU,,Yes,,"Earthquake, Rock Slide, Stone Edge"
Delcatty,,,,RU,,,,"Ice Beam, Play Rough, Wild Charge, Stomping Tantrum, Mud Bomb"
Delibird,Ice,,,RU,,,Yes,"Ice, Freeze Dry, Drill Run"
Delphox,,,,RU,,,,"Dazzling Gleam, Thunder Punch, Scorching Sands"
Deoxys-Defense,,,,RU,,,,"Meteor Beam, Zap Cannon, Ice Beam, Ice Punch, Rock Slide, Stomping Tantrum, Thunder Punch"
Dewgong,Water,Ice,,RU,,,,"Water, Ice, Play Rough, Drill Run"
Diancie,Rock,Fairy,,RU,,,,"Rock, Fairy, Earth Power, Scorching Sands"
Diggersby,,Ground,,RU,,,,"Ground, Stone Edge, Surf, Wild Charge, Ice Punch, Rock Slide, Thunder Punch"
Donphan,Ground,,,RU,,Yes,,"Ground, Head Smash, Stone Edge, Play Rough, Ice Spinner, Rock Slide, Ice Fang, Thunder Fang, Ice Shard"
Dracozolt,Electric,Dragon,,RU,,,,"Electric, Dragon, Meteor Beam, Earthquake, Stone Edge, Earth Power, Rock Slide, Rock Blast"
Drampa,,Dragon,,RU,,,,"Dragon, Hydro Pump, Earthquake, Ice Beam, Play Rough, Surf, Rock Slide"
Drapion,,,,RU,,,,"Earthquake, Aqua Tail, Rock Slide, Ice Fang, Thunder Fang"
Drednaw,Water,Rock,,RU,,,,"Water, Rock, Earthquake, Earth Power, Ice Beam, Ice Spinner, Ice Fang, Scale Shot"
Druddigon,Dragon,,,RU,,,,"Dragon, Earthquake, Aqua Tail, Surf, Rock Slide, Thunder Punch, Thunder Fang"
Dudunsparce,,,,RU,,,,"Outrage, Zap Cannon, Earthquake, Dragon Rush, Aqua Tail, Earth Power, Ice Beam, Wild Charge, Drill Run, Ice Spinner, Rock Slide, Breaking Swipe, Scale Shot"
Dugtrio,Ground,,,RU,,,,"Ground, Stone Edge, Rock Slide, Rock Blast"
Dugtrio-Alola,Ground,,,RU,,,,"Ground, Stone Edge, Rock Slide, Rock Blast"
Duraludon,,Dragon,,RU,,,,"Dragon, Stone Edge, Rock Slide, Stomping Tantrum"
Durant,,,,RU,,,,"Stone Edge, Rock Slide, Stomping Tantrum, Thunder Fang"
Eelektross,Electric,,,RU,,,,"Electric, Outrage, Aqua Tail, Dragon Pulse, Liquidation, Dragon Claw, Rock Slide, Stomping Tantrum"
Electivire,Electric,,,RU,,,,"Electric, Earthquake, Ice Punch, Rock Slide, Dual Chop"
Emboar,,,,RU,,,,"Head Smash, Earthquake, Stone Edge, Scald, Rock Slide, Thunder Punch"
Empoleon,Water,,,RU,,Yes,,"Water, Earthquake, Ice Beam, Ice Spinner, Rock Slide, Avalanche, Triple Axel"
Entei,,,,RU,,,,"Stone Edge, Stomping Tantrum, Scorching Sands"
Exploud,,,,RU,,,,"Outrage, Hydro Pump, Earthquake, Ice Beam, Surf, Ice Punch, Rock Slide, Thunder Punch, Ice Fang, Thunder Fang, Avalanche"
Falinks,,,,RU,,,,"High Horsepower, Rock Slide"
Farigiraf,,,,RU,,,,"Zap Cannon, Earthquake, Dazzling Gleam"
Feraligatr,Water,,,RU,,,,"Water, Outrage, Earthquake, Ice Beam, Dragon Pulse, Dragon Claw, Ice Punch, Rock Slide, Ice Fang, Avalanche, Breaking Swipe, Scale Shot"
Flareon,,,,RU,,,,"Zap Cannon, Alluring Voice, Scorching Sands"
Flygon,Ground,Dragon,,RU,,Yes,,"Ground, Dragon, Earthquake, Stone Edge, Alluring Voice, Rock Slide, Thunder Punch"
Forretress,,,,RU,,,,"Zap Cannon, Earthquake, Stone Edge, Earth Power, Drill Run, Ice Spinner, Rock Slide, Volt Switch"
Gallade,,,,RU,,,,"Earthquake, Stone Edge, Alluring Voice, Dazzling Gleam, Ice Punch, Thunder Punch, Rock Slide, Aqua Cutter, Dual Chop, Triple Axel"
Garbodor,,,,RU,,,,"Stomping Tantrum, Rock Blast"
Gastrodon,Water,Ground,,RU,,Yes,,"Water, Ground, Stone Edge, Earth Power, Ice Beam, Rock Slide, Rock Blast"
Gigalith,Rock,,,RU,,,,"Rock, Earthquake, Earth Power"
Glalie,Ice,,,RU,,,,"Ice, Freeze Dry, Earthquake"
Gogoat,,,,RU,,,,"Earthquake, Play Rough, Surf, Wild Charge, Rock Slide"
Golduck,Water,,,RU,,,,"Water, Ice Beam, Power Gem, Ice Punch, Mud Bomb"
Golem,Rock,Ground,,RU,,,,"Rock, Ground, Thunder Punch"
Golem-Alola,Rock,Electric,,RU,,,,"Rock, Electric, Earthquake, Earth Power"
Golisopod,,Water,,RU,,,,"Water, Ice Beam, Drill Run, Rock Slide, Dual Chop"
Golurk,Ground,,,RU,,,,"Ground, Stone Edge, Ice Beam, Ice Punch, Thunder Punch, Rock Slide"
Goodra,Dragon,,,RU,,Yes,,"Dragon, Hydro Pump, Earthquake, Aqua Tail, Ice Beam, Surf, Muddy Water, Scald, Rock Slide, Thunder Punch"
Goodra-Hisui,,Dragon,,RU,,,,"Dragon, Hydro Pump, Earthquake, Ice Beam, Surf, Muddy Water, Ice Spinner, Rock Slide, Thunder Punch"
Granbull,Fairy,,,RU,,Yes,,"Fairy, Outrage, Zap Cannon, Earthquake, Stone Edge, Wild Charge, Ice Punch, Rock Slide, Thunder Punch, Ice Fang, Thunder Fang"
Grapploct,,,,RU,,,,"Hydro Pump, Surf, Muddy Water, Liquidation, Waterfall, Dive, Ice Punch, Stomping Tantrum, Brine, Octazooka"
Greedent,,,,RU,,,,"Earthquake, Wild Charge, Ice Fang, Thunder Fang"
Grimmsnarl,,Fairy,,RU,,,,"Fairy, Ice Punch, Stomping Tantrum, Thunder Punch"
Grumpig,,,,RU,,,,"Earth Power, Dazzling Gleam, Power Gem, Ice Punch, Stomping Tantrum, Thunder Punch"
Gumshoos,,,,RU,,,,"Earthquake, Wild Charge, Ice Punch, Thunder Punch, Ice Fang, Thunder Fang, Dual Chop"
Guzzlord,,Dragon,,RU,,,,"Dragon, Earthquake, Stone Edge, Rock Slide"
Hariyama,,,,RU,,,,"Headlong Rush, Earthquake, Stone Edge, Surf, Ice Punch, Thunder Punch, Rock Slide, Brine"
Heatmor,,,,RU,,,,"Stomping Tantrum, Thunder Punch, Scorching Sands"
Heracross,,,,RU,,,,"Earthquake, Stone Edge, Rock Slide, Rock Blast"
Hitmonchan,,,,RU,,,,"Earthquake, Stone Edge, Rock Slide, Thunder Punch, Ice Punch"
Hitmonlee,,,,RU,,,,"Earthquake, Stone Edge, Rock Slide"
Hitmontop,,,,RU,,,,"Earthquake, Stone Edge, Drill Run, Ice Spinner, Rock Slide, Triple Axel"
Houndstone,,,,RU,,,,"Play Rough, Stomping Tantrum, Ice Fang, Thunder Fang"
Incineroar,,,,RU,,,,"Outrage, Earthquake, Thunder Punch, Scorching Sands, Dual Chop"
Infernape,,,,RU,,,,"Earthquake, Stone Edge, Rock Slide, Thunder Punch, Scorching Sands, Dual Chop"
Iron Jugulis,,,,RU,,,,"Meteor Beam, Outrage, Hydro Pump, Earth Power, Dragon Pulse"
Iron Thorns,Rock,Electric,,RU,,,,"Rock, Electric, Earthquake, Earth Power, Ice Beam, Dragon Claw, Ice Punch, Ice Fang, Breaking Swipe"
Kabutops,Rock,Water,,RU,,,,"Rock, Water, Earth Power, Ice Beam, Aurora Beam"
Kangaskhan,,,,RU,,,,"Outrage, Zap Cannon, Earthquake, Aqua Tail, Surf, Ice Beam, Thunder Punch, Ice Punch, Rock Slide, Avalanche, Bubble Beam, Hydro Pump"
Kingler,Water,,,RU,,,,"Water, High Horsepower, Ice Beam, Rock Slide, Stomping Tantrum"
Klawf,Rock,,,RU,Yes,,,"Rock, Crabhammer, High Horsepower, Earth Power, Stomping Tantrum"
Komala,,,,RU,,,,"Earthquake, Play Rough, Ice Spinner, Rock Slide"
Krookodile,Ground,,,RU,,,,"Ground, Outrage, Stone Edge, Aqua Tail, Dragon Pulse, Dragon Claw, Rock Slide, Thunder Fang, Breaking Swipe, Scale Shot"
Lapras,Water,Ice,,RU,,,,"Water, Ice, Freeze Dry, Outrage, Zap Cannon, Earthquake, Dragon Pulse, Alluring Voice, Drill Run"
Latias,Dragon,,,RU,,,,"Dragon, Earthquake, Ice Beam, Surf, Liquidation, Alluring Voice, Waterfall, Dive"
Lickilicky,,,,RU,,,,"Hydro Pump, Earthquake, Aqua Tail, Surf, Ice Beam, Muddy Water, Ice Punch, Thunder Punch, Rock Slide, Stomping Tantrum, Bubble Beam"
Linoone,,,,RU,Yes,,,"Ice Beam, Surf, Play Rough, Stomping Tantrum"
Lucario,,,,RU,,,,"Earthquake, Stone Edge, Dragon Pulse, Rock Slide, Thunder Punch, Ice Punch, Bone Rush"
Lunatone,Rock,,,RU,,,,"Rock, Earthquake, Moonblast, Earth Power, Ice Beam"
Lycanroc,Rock,,,RU,,,,"Rock, Earth Power, Play Rough, Drill Run, Stomping Tantrum, Thunder Fang"
Lycanroc-Dusk,Rock,,,RU,,,,"Rock, Outrage, Earth Power, Play Rough, Drill Run, Stomping Tantrum, Thunder Fang"
Lycanroc-Midnight,Rock,,,RU,,,,"Rock, Outrage, Earth Power, Play Rough, Stomping Tantrum, Thunder Punch, Thunder Fang, Dual Chop"
Machamp,,,,RU,,,,"Earthquake, Stone Edge, Ice Punch, Rock Slide, Thunder Punch, Dual Chop, Rock Blast"
Magcargo,,Rock,,RU,,,,"Rock, Earthquake, Scorching Sands, Earth Power"
Magmortar,,,,RU,,Yes,,"Earthquake, Rock Slide, Thunder Punch, Scorching Sands, Dual Chop"
Mantine,Water,,,RU,,,,"Water, Earthquake, Ice Beam, Rock Slide, Rock Blast"
Marowak,Ground,,,RU,,,,"Ground, Outrage, Stone Edge, Ice Beam, Rock Slide, Thunder Punch, Bubble Beam"
Marowak-Alola,,,,RU,,,,"Outrage, Earthquake, Stone Edge, Earth Power, Ice Beam, Rock Slide, Thunder Punch, Scorching Sands, Bone Club, Bonemerang, Bone Rush"
Metagross,,,,RU,,Yes,,"Meteor Beam, Earthquake, Stone Edge, Ice Punch, Rock Slide, Thunder Punch"
Miltank,,,,RU,,,,"Earthquake, Ice Beam, Play Rough, Surf, Ice Punch, Rock Slide, Thunder Punch"
Minior,Rock,,,RU,,,,"Rock, Earthquake, Earth Power, Dazzling Gleam, Scorching Sands"
Morpeko,Electric,,,RU,,,,"Electric, Outrage, Stomping Tantrum, Ice Fang"
Mr. Rime,Ice,,,RU,,,,"Ice, Freeze Dry, Dazzling Gleam, Stomping Tantrum"
Mudsdale,Ground,,,RU,,,,"Ground, Stone Edge"
Muk,,,,RU,,,,"Zap Cannon, Moonblast, Ice Punch, Rock Slide, Thunder Punch, Mud Bomb"
Necrozma,,,,RU,,,,"Meteor Beam, Outrage, Earthquake, Stone Edge, Earth Power, Dragon Pulse, Power Gem, Rock Slide, Breaking Swipe, Rock Blast"
Nidoking,,Ground,,RU,,,,"Ground, Head Smash, Outrage, Stone Edge, Aqua Tail, Ice Beam, Surf, Dragon Pulse, Ice Punch, Rock Slide, Thunder Punch, Bubble Beam, Avalanche, Rock Blast"
Nidoqueen,,Ground,,RU,,,,"Ground, Outrage, Stone Edge, Aqua Tail, Ice Beam, Surf, Dragon Pulse, Ice Punch, Rock Slide, Thunder Punch, Bubble Beam, Avalanche, Rock Blast"
Obstagoon,,,,RU,,,,"Ice Beam, Surf, Ice Punch, Stomping Tantrum, Thunder Punch"
Okidogi,,,,RU,,,,"Outrage, High Horsepower, Ice Punch, Stomping Tantrum, Thunder Punch, Ice Fang, Thunder Fang"
Omastar,Rock,Water,,RU,,,,"Rock, Water, Earth Power, Ice Beam, Aurora Beam"
Orthworm,,,,RU,,,,"Earthquake, Earth Power, Rock Slide, Rock Blast"
Palossand,,Ground,,RU,,,,"Ground, Stone Edge, Rock Slide, Brine"
Pangoro,,,,RU,,,,"Outrage, Earthquake, Stone Edge, Surf, Dragon Claw, Ice Punch, Rock Slide, Thunder Punch, Dual Chop"
Passimian,,,,RU,,,,"Earthquake, Rock Slide"
Rhyperior,Ground,Rock,,RU,,,,"Ground, Rock"
Sandy Shocks,Electric,Ground,,RU,,Yes,,"Electric, Ground"
Stunfisk,Ground,Electric,,RU,,,,"Ground, Electric"
