Name,MonType1,MonType2,MonType3,Useful_Attributes
Abomasnow,Grass,,,"Grass, Brick Break, Earthquake, Earth Power, Iron Tail, Low Kick, Rock Slide, Shadow Ball, Body Press"
Absol,Dark,,,"Dark, Close Combat, Iron Tail, Megahorn, Rock Slide, Shadow Claw, Stone Edge, X Scissor, Shadow Ball"
Accelgor,Bug,,,"Bug, Focus Blast, Energy Ball, Water Shuriken, Knock Off, Drain Punch, Reversal"
Aggron,Steel,Rock,,"Steel, Rock, Aqua Tail, Body Press, Crunch, Earthquake, Low Kick, Shadow Claw, Superpower, Payback, Dark Pulse, Earth Power, Focus Blast, Surf, Dynamic Punch, Payback, Reversal"
Ambipom,,,,"Low Kick, Foul Play, Knock Off, Seed Bomb, Shadow Claw, Iron Tail, Fury Cutter, Trailblaze, Smack Down, Payback, Brick Break, Chilling Water, Grass Knot, Shadow Ball, Throat Chop, Dynamic Punch, Low Sweep, Payback, Revenge, Smack Down, Beat Up"
Ampharos,,,,"Focus Blast, Power Gem, Signal Beam, Brick Break, Iron Tail, Low Kick, Meteor Beam, Stomping Tantrum, Dynamic Punch"
Appletun,Grass,,,"Grass, Body Press, Earthquake, Gyro Ball, Iron Head, Sucker Punch, Superpower, Payback, Heavy Slam"
Arcanine,,,,"Close Combat, Crunch, Iron Head, Scorching Sands, Iron Tail, Reversal, Solar Beam, Scorching Sands"
Arcanine-Hisui,,Rock,,"Rock, Close Combat, Crunch, Iron Head, Solar Beam, Scorching Sands, Smart Strike"
Archeops,Rock,,,"Rock, Aqua Tail, Crunch, Earthquake, Iron Tail, Knock Off, Shadow Claw, Steel Wing, Focus Blast, Earth Power, Lash Out"
Arctozolt,,,,"Iron Tail, Low Kick, Rock Slide, Stone Edge, Meteor Beam, Payback, Hydro Pump, Surf, Stomping Tantrum, Rock Blast"
Armaldo,Rock,Bug,,"Rock, Bug, Aqua Jet, Low Kick, Brick Break, Earthquake, Iron Tail, Knock Off, Liquidation, Shadow Claw, Aqua Tail, Superpower, Earth Power"
Armarouge,,,,"Aura Sphere, Dark Pulse, Energy Ball, Flash Cannon, Focus Blast, Meteor Beam, Scorching Sands, Shadow Ball, Solar Beam"
Audino,,,,"Drain Punch, Grass Knot, Iron Tail, Knock Off, Low Kick, Shadow Ball, Signal Beam, Stomping Tantrum, Surf, Throat Chop, Solar Beam"
Avalugg,,,,"Body Press, Crunch, Earthquake, Gyro Ball, Heavy Slam, Iron Head, Rock Slide, Stone Edge, Flash Cannon, Superpower"
Avalugg-Hisui,,Rock,,"Rock, Body Press, Crunch, Earthquake, Gyro Ball, Heavy Slam, Iron Head, Superpower, Surf, Flash Cannon"
Azumarill,Water,,,"Water, Brick Break, Focus Blast, Grass Knot, Iron Tail, Knock Off, Superpower, Dynamic Punch"
Barbaracle,Rock,Water,,"Rock, Water, Cross Chop, Earthquake, Low Kick, Night Slash, Shadow Claw, X Scissor, Payback, Brick Break, Focus Blast, Grass Knot, Superpower, Payback, Beat Up"
Barraskewda,Water,,,"Water, Close Combat, Crunch, Drill Run, Throat Chop, Brick Break, Night Slash"
Basculin,Water,,,"Water, Crunch, Head Smash, Superpower, Reversal, Revenge"
Bastiodon,Rock,Steel,,"Rock, Steel, Body Press, Earthquake, Foul Play, Scorching Sands, Reversal, Earth Power"
Beartic,,,,"Aqua Jet, Close Combat, Crunch, Earthquake, Heavy Slam, Liquidation, Rock Slide, Shadow Claw, Stone Edge, X Scissor, Hard Press, Reversal, Grass Knot, Low Kick, Surf, Body Press, Throat Chop, Dive, Brick Break, Night Slash, Brine"
Beedrill,Bug,,,"Bug, Brick Break, Drill Run, Knock Off, Throat Chop, Payback, Solar Beam"
Bewear,,Fighting,,"Fighting, Darkest Lairat, Earthquake, Iron Head, Rock Slide, Shadow Claw, Payback"
Bibarel,,Water,,"Water, Crunch, Iron Tail, Stomping Tantrum, Superpower, Grass Knot, Shadow Ball"
Blastoise,Water,,,"Water, Aura Sphere, Body Press, Crunch, Dark Pulse, Earthquake, Flash Cannon, Iron Tail, Rock Slide, Signal Beam, Gyro Ball, Dynamic Punch, Brick Break, Submission"
Blissey,,,,"Focus Blast, Grass Knot, Shadow Ball, Bubble Beam, Solar Beam, Mud Bomb"
Bouffalant,,,,"Close Combat, Earthquake, Iron Head, Throat Chop, Megahorn, Rock Slide, Stone Edge, Payback, Reversal, Lash Out, Smart Strike"
Braviary,,,,"Close Combat, Iron Head, Rock Slide, Shadow Claw, Reversal, Steel Wing"
Braviary-Hisui,,,,"Shadow Ball, Vacuum Wave, Close Combat, Reversal, Rock Slide, Shadow Claw"
Breloom,Grass,Fighting,,"Grass, Fighting, Rock Slide, Stone Edge, Pounce"
Bronzong,Steel,,,"Steel, Body Press, Earthquake, Grass Knot, Power Gem, Rock Slide, Shadow Ball, Signal Beam, Payback, Hex, Meteor Beam, Rock Blast, Solar Beam"
Brute Bonnet,Grass,Dark,,"Grass, Dark, Close Combat, Stomping Tantrum, Earth Power, Pollen Puff, Body Press, Hex"
Cacturne,Grass,Dark,,"Grass, Dark, Low Kick, Lunge, Shadow Ball, Stomping Tantrum, Pin Missile, Superpower, Dynamic Punch, Drain Punch, Skitter Smack, Revenge"
Camerupt,,Ground,,"Ground, Body Press, Flash Cannon, Iron Head, Lash Out, Rock Slide, Stone Edge, Heavy Slam, Solar Beam"
Carracosta,Water,Rock,,"Water, Rock, Crunch, Earthquake, Iron Head, Knock Off, Low Kick, Superpower, Earth Power, Focus Blast, Iron Tail"
Celebi,,Grass,,"Grass, Aura Sphere, Earth Power, Shadow Ball, Signal Beam, Sucker Punch, Pollen Puff"
Cetitan,,,,"Heavy Slam, Superpower, Earthquake, Liquidation, Knock Off, Body Press, Hard Press"
Charizard,,,,"Brick Break, Crunch, Earthquake, Rock Slide, Shadow Claw, Focus Blast, Iron Tail, Scorching Sands, Beat Up, Dynamic Punch, Solar Beam, Submission"
Chesnaught,Grass,Fighting,,"Grass, Fighting, Crunch, Earthquake, Iron Head, Knock Off, Rock Slide, Shadow Claw, Stone Edge, Payback, Pin Missile, Gyro Ball, Iron Tail"
Cinccino,,,,"Knock Off, Rock Blast, Seed Bomb, Trailblaze, Bullet Seed, Focus Blast, Wake Up Slap, Chilling Water, Grass Knot, Iron Tail, Thief"
Clawitzer,Water,,,"Water, Aura Sphere, Dark Pulse, Flash Cannon, Focus Blast, Shadow Ball, Iron Tail, Rock Slide"
Claydol,Ground,,,"Ground, Body Press, Grass Knot, Hex, Shadow Ball, Signal Beam, Rock Slide, Stone Edge, Gyro Ball, Solar Beam"
Cobalion,Steel,Fighting,,"Steel, Fighting, Megahorn, X Scissor, Stone Edge"
Copperajah,Steel,,,"Steel, Body Press, Brick Break, Earthquake, Knock Off, Power Whip, Rock Slide, Stone Edge, Superpower, Payback, Earth Power, Rock Blast, Revenge"
Crabominable,Fighting,,,"Fighting, Crabhammer, Earthquake, Iron Head, Knock Off, Liquidation, Rock Slide, Stone Edge, Payback, Hard Press, Liquidation, Payback"
Cramorant,,Water,,"Water, Steel Wing, Superpower, Throat Chop, Reversal"
Crawdaunt,Water,Dark,,"Water, Dark, Close Combat, Rock Slide, X Scissor, Hard Press, Lash Out"
Crustle,Bug,Rock,,"Bug, Rock, Body Press, Earthquake, Heavy Slam, Knock Off, Shadow Claw, Night Slash, Solar Beam, Solar Blade"
Cursola,Ghost,,,"Ghost, Earth Power, Giga Drain, Hydro Pump, Leech Life, Meteor Beam, Power Gem, Scald, Head Smash, Earthquake, Stone Edge, Surf, Liquidation, Leech Life, Throat Chop, Rock Slide, Brine, Revenge, Rock Blast, Pin Missile"
Dachsbun,,,,"Body Press, Crunch, Stomping Tantrum"
Darmanitan,,,,"Reversal, Body Press, Brick Break, Earthquake, Hammer Arm, Iron Head, Lash Out, Rock Slide, Stone Edge, Superpower, Payback"
Delcatty,,,,"Grass Knot, Solar Beam, Iron Tail, Shadow Ball, Stomping Tantrum, Sucker Punch, Wake Up Slap, Payback, Mud Bomb"
Delibird,,,,"Reversal, Foul Play, Drill Run, Seed Bomb, Brick Break, Steel Wing"
Delphox,,,,"Focus Blast, Grass Knot, Low Kick, Solar Beam, Iron Tail, Foul Play, Shadow Ball, Signal Beam, Scorching Sands, Hex"
Deoxys-Defense,,,,"Focus Blast, Grass Knot, Low Kick, Meteor Beam, Solar Beam, Superpower, Dynamic Punch, Energy Ball, Meteor Mash, Dark Pulse, Flash Cannon, Shadow Ball, Throat Chop, Brick Break, Drain Punch, Rock Slide, Signal Beam, Stomping Tantrum, Knock Off, Low Sweep"
Diggersby,,Ground,,"Ground, Grass Knot, Low Kick, Superpower, Hammer Arm, Stone Edge, Iron Tail, Foul Play, Surf, Iron Head, Brick Break, Rock Slide, Knock Off, Payback"
Dodrio,,,,"Low Kick, Jump Kick, Drill Run, Lunge, Throat Chop, Stomping Tantrum, Steel Wing, Knock Off, Payback"
Donphan,Ground,,,"Ground, Gyro Ball, Head Smash, Superpower, Heavy Slam, Stone Edge, Iron Tail, Body Press, Iron Head, Seed Bomb, Throat Chop, Rock Slide, Smart Strike, Knock Off, Assurance"
Dragalge,,,,"Focus Blast, Hydro Pump, Iron Tail, Liquidation, Aqua Tail, Surf, Muddy Water, Shadow Ball, Scald, Waterfall, Dive, Flip Turn"
Drampa,,,,"Focus Blast, Grass Knot, Superpower, Solar Beam, Hydro Pump, Earthquake, Energy Ball, Surf, Shadow Ball, Lash Out, Rock Slide, Shadow Claw, Steel Wing"
Drapion,,Dark,,"Dark, Earthquake, Iron Tail, Aqua Tail, Bug Buzz, Shadow Ball, X Scissor, Brick Break, Rock Slide, Skitter Smack, Pin Missile"
Drednaw,Water,Rock,,"Water, Rock, Megahorn, Superpower, Earthquake, Earth Power, Body Press, Crunch, Throat Chop, Jaw Lock, Skitter Smack, Smart Strike, Payback"
Druddigon,,,,"Focus Blast, Superpower, Earthquake, Iron Tail, Aqua Tail, Surf, Crunch, Dark Pulse, Flash Cannon, Iron Head, Lash Out, Rock Slide, Shadow Claw, Sucker Punch, Night Slash, Payback"
Dudunsparce,,,,"Gyro Ball, Heavy Slam, Solar Beam, Earthquake, Iron Tail, Aqua Tail, Earth Power, Body Press, Drill Run, Lunge, Shadow Ball, Throat Chop, Rock Slide, Skitter Smack, Smart Strike, Hex"
Dugtrio,Ground,,,"Ground, Reversal, Stone Edge, Foul Play, Throat Chop, Rock Slide, Night Slash, Shadow Claw, Sucker Punch, Rock Blast, Beat Up"
Dugtrio-Alola,Ground,Steel,,"Ground, Steel, Reversal, Stone Edge, Foul Play, Throat Chop, Rock Slide, Night Slash, Shadow Claw, Sucker Punch, Rock Blast, Beat Up"
Duraludon,Steel,,,"Steel, Solar Beam, Stone Edge, Foul Play, Body Press, Dark Pulse, Brick Break, Rock Slide, Stomping Tantrum, Night Slash"
Durant,Bug,Steel,,"Bug, Steel, Superpower, Stone Edge, Energy Ball, Crunch, Rock Slide, Stomping Tantrum, Shadow Claw, Skitter Smack, Beat Up"
Dusknoir,Ghost,,,"Ghost, Hard Press, Focus Blast, Dynamic Punch, Darkest Lairat, Dark Pulse, Leech Life, Brick Break, Rock Slide, Sucker Punch, Skitter Smack, Revenge, Payback"
Eelektross,,,,"Close Combat, Grass Knot, Superpower, Heavy Slam, Iron Tail, Aqua Tail, Liquidation, Body Press, Crunch, Flash Cannon, Lunge, Throat Chop, Brick Break, Drain Punch, Giga Drain, Rock Slide, Signal Beam, Stomping Tantrum, Hex, Knock Off"
Electivire,,,,"Focus Blast, Low Kick, Cross Chop, Earthquake, Hammer Arm, Iron Tail, Dynamic Punch, Darkest Lairat, Submission, Brick Break, Rock Slide, Signal Beam, Knock Off, Low Sweep"
Emboar,,Fighting,,"Fighting, Hard Press, Head Smash, Gyro Ball, Grass Knot, Heavy Slam, Solar Beam, Earthquake, Stone Edge, Iron Tail, Iron Head, Scald, Rock Slide, Sucker Punch, Knock Off"
Empoleon,Water,Steel,,"Water, Steel, Grass Knot, Earthquake, Throat Chop, Brick Break, Lash Out, Rock Slide, Signal Beam, Shadow Claw, Knock Off, Vacuum Wave, Power Trip"
Entei,,,,"Reversal, Solar Beam, Stone Edge, Iron Tail, Crunch, Iron Head, Shadow Ball, Stomping Tantrum, Scorching Sands"
Escavalier,Bug,Steel,,"Bug, Steel, Reversal, Close Combat, Focus Blast, Energy Ball, Drill Run, Giga Drain, Razor Shell, Night Slash, Knock Off, Revenge"
Exeggutor-Alola,Grass,,,"Grass, Low Kick, Superpower, Earthquake, Iron Head, Brick Break, Knock Off"
Exploud,,,,"Focus Blast, Low Kick, Solar Beam, Hydro Pump, Earthquake, Hammer Arm, Dynamic Punch, Surf, Crunch, Shadow Ball, Brick Break, Rock Slide"
Falinks,Fighting,,,"Fighting, Megahorn, High Horsepower, First Impression, Iron Head, Lunge, Throat Chop, Rock Slide, Smart Strike, Knock Off, Payback, Beat Up"
Farigiraf,,,,"Grass Knot, Low Kick, Earthquake, Iron Tail, Foul Play, Energy Ball, Crunch, Iron Head, Shadow Ball, Signal Beam, Sucker Punch, Beat Up"
Feraligatr,Water,,,"Water, Focus Blast, Low Kick, Superpower, Earthquake, Iron Tail, Dynamic Punch, Crunch, Brick Break, Lash Out, Rock Slide, Shadow Claw"
Flamigo,,Fighting,,"Fighting, Liquidation, Lunge, Throat Chop, Payback"
Flareon,,,,"Superpower, Iron Tail, Shadow Ball, Scorching Sands"
Floatzel,Water,,,"Water, Focus Blast, Low Kick, Iron Tail, Crunch, Brick Break, Low Sweep, Payback"
Flygon,Ground,,,"Ground, Superpower, Solar Beam, Earthquake, Iron Tail, Stone Edge, Bug Buzz, First Impression, Crunch, Throat Chop, Giga Drain, Rock Slide, Signal Beam, Steel Wing, Vacuum Wave"
Forretress,Bug,Steel,,"Bug, Steel, Reversal, Solar Beam, Earthquake, Stone Edge, Earth Power, Body Press, Drill Run, Seed Bomb, Giga Drain, Rock Slide, Revenge"
Furret,,,,"Reversal, Focus Blast, Grass Knot, Solar Beam, Iron Tail, Dynamic Punch, Aqua Tail, Surf, Seed Bomb, Shadow Ball, Brick Break, Shadow Claw, Sucker Punch, Knock Off"
Gallade,,Fighting,,"Fighting, Solar Blade, Grass Knot, Earthquake, Stone Edge, Energy Ball, Leaf Blade, Shadow Ball, Throat Chop, X Scissor, Rock Slide, Signal Beam, Aqua Cutter, Shadow Claw, Night Slash, Hex, Knock Off, Shadow Sneak"
Garbodor,,,,"Focus Blast, Solar Beam, Body Press, Dark Pulse, Seed Bomb, Drain Punch, Giga Drain, Stomping Tantrum, Payback, Rock Blast"
Gigalith,Rock,,,"Rock, Heavy Slam, Superpower, Solar Beam, Earthquake, Earth Power, Body Press, Flash Cannon, Iron Head, Throat Chop"
Gogoat,Grass,,,"Grass, Superpower, Earthquake, Iron Tail, Surf, Throat Chop, Brick Break, Rock Slide, Payback"
Golduck,Water,,,"Water, Focus Blast, Grass Knot, Low Kick, Cross Chop, Iron Tail, Dynamic Punch, Power Gem, Submission, Brick Break, Signal Beam, Shadow Claw, Knock Off, Low Sweep, Mud Bomb, Vacuum Wave"
Golem,Rock,Ground,,"Rock, Ground, Hard Press, Gyro Ball, Focus Blast, Heavy Slam, Superpower, Hammer Arm, Dynamic Punch, Body Press, Iron Head, Submission, Brick Break, Sucker Punch, Steamroller"
Golem-Alola,Rock,,,"Rock, Hard Press, Gyro Ball, Focus Blast, Heavy Slam, Superpower, Earthquake, Earth Power, Body Press, Brick Break, Steamroller"
Golisopod,Bug,Water,,"Bug, Water, Close Combat, Focus Blast, Dark Pulse, Drill Run, Iron Head, Throat Chop, Brick Break, Rock Slide, Shadow Claw, Sucker Punch, Knock Off, Payback"
Golurk,Ground,Ghost,,"Ground, Ghost, Hard Press, Gyro Ball, Close Combat, Focus Blast, Grass Knot, Heavy Slam, Low Kick, Superpower, Solar Beam, Hammer Arm, Stone Edge, Dynamic Punch, Darkest Lairat, Body Press, Flash Cannon, Brick Break, Drain Punch, Rock Slide, Signal Beam, Knock Off, Low Sweep"
Goodra,,,,"Focus Blast, Power Whip, Superpower, Hydro Pump, Earthquake, Iron Tail, Aqua Tail, Surf, Muddy Water, Body Press, Scald, Rock Slide, Skitter Smack, Knock Off"
Goodra-Hisui,Steel,,,"Steel, Hydro Pump, Earthquake, Surf, Muddy Water, Body Press, Lash Out, Rock Slide, Skitter Smack, Knock Off"
Gothitelle,,,,"Focus Blast, Grass Knot, Foul Play, Energy Ball, Dark Pulse, Shadow Ball, Brick Break, Rock Slide, Signal Beam, Low Sweep, Payback"
Gourgeist,Ghost,Grass,,"Ghost, Grass, Gyro Ball, Focus Blast, Foul Play, Dark Pulse, Rock Slide, Skitter Smack"
Granbull,,,,"Reversal, Close Combat, Focus Blast, Low Kick, Solar Beam, Earthquake, Iron Tail, Stone Edge, Dynamic Punch, Crunch, Shadow Ball, Brick Break, Lash Out, Rock Slide, Low Sweep, Payback"
Grapploct,Fighting,,,"Fighting, Hydro Pump, Surf, Muddy Water, Liquidation, Waterfall, Dive, Stomping Tantrum, Sucker Punch, Skitter Smack, Brine, Octazooka, Payback"
Greedent,,,,"Gyro Ball, Superpower, Earthquake, Iron Tail, Body Press, Crunch, Seed Bomb, Knock Off, Payback, Bullet Seed"
Grimmsnarl,Dark,,,"Dark, Focus Blast, Low Kick, Power Whip, Superpower, Hammer Arm, Body Press, Leech Life, Brick Break, Drain Punch, Stomping Tantrum, Shadow Claw, Low Sweep, Revenge"
Grumpig,,,,"Focus Blast, Grass Knot, Low Kick, Iron Tail, Dynamic Punch, Earth Power, Energy Ball, Body Press, Flash Cannon, Lunge, Power Gem, Seed Bomb, Shadow Ball, Brick Break, Drain Punch, Signal Beam, Stomping Tantrum, Low Sweep, Payback"
Gumshoos,,,,"Reversal, Earthquake, Iron Tail, Crunch, Seed Bomb, Iron Head, Knock Off, Low Sweep, Revenge, Payback"
Guzzlord,Dark,,,"Dark, Gyro Ball, Earthquake, Heavy Slam, Hammer Arm, Stone Edge, Iron Tail, Body Press, Iron Head, Brick Break, Drain Punch, Rock Slide, Shadow Claw, Steamroller"
Hariyama,Fighting,,,"Fighting, Headlong Rush, Heavy Slam, Earthquake, Stone Edge, Surf, Iron Head, Throat Chop, Lash Out, Rock Slide, Knock Off, Brine, Payback, Bullet Punch"
Heatmor,,,,"Focus Blast, Low Kick, Superpower, Solar Beam, Throat Chop, Drain Punch, Giga Drain, Stomping Tantrum, Scorching Sands, Shadow Claw, Sucker Punch, Night Slash, Knock Off"
Heliolisk,,,,"Focus Blast, Grass Knot, Low Kick, Solar Beam, Iron Tail, Surf, Dark Pulse, Rock Slide, Signal Beam, Low Sweep"
Heracross,Bug,Fighting,,"Bug, Fighting, Earthquake, Stone Edge, Throat Chop, Rock Slide, Shadow Claw, Night Slash, Smart Strike, Knock Off, Rock Blast, Bullet Seed"
Hitmonchan,Fighting,,,"Fighting, Earthquake, Stone Edge, Throat Chop, Rock Slide, Knock Off, Bullet Punch"
Hitmonlee,Fighting,,,"Fighting, Earthquake, Stone Edge, Lunge, Throat Chop, Rock Slide, Sucker Punch, Knock Off, Bullet Punch"
Hitmontop,Fighting,,,"Fighting, Gyro Ball, Earthquake, Stone Edge, Drill Run, Rock Slide, Sucker Punch, Brutal Swing, Thief, Bullet Punch"
Houndstone,Ghost,,,"Ghost, Body Press, Crunch, Stomping Tantrum"
Incineroar,,Dark,,"Dark, Reversal, Close Combat, Focus Blast, Low Kick, Cross Chop, Earthquake, Iron Head, Leech Life, Brick Break, Drain Punch, Scorching Sands, Shadow Claw, Low Sweep, Revenge"
Infernape,,Fighting,,"Fighting, Grass Knot, Solar Beam, Earthquake, Stone Edge, Iron Tail, Throat Chop, Lash Out, Rock Slide, Scorching Sands, Shadow Claw, Knock Off"
Inteleon,Water,,,"Water, Dark Pulse, Shadow Ball, Sucker Punch, Skitter Smack, Vacuum Wave"
Iron Jugulis,Dark,,,"Dark, Focus Blast, Meteor Beam, Hydro Pump, Earth Power, Flash Cannon, Iron Head"
Iron Thorns,Rock,,,"Rock, Focus Blast, Heavy Slam, Low Kick, Earthquake, Earth Power, Body Press, Crunch, Iron Head, Brick Break, Pin Missile"
Jynx,,,,"Focus Blast, Grass Knot, Dynamic Punch, Energy Ball, Shadow Ball, Submission, Brick Break, Drain Punch, Signal Beam, Wake Up Slap, Bubble Beam, Payback"
Kabutops,Rock,Water,,"Rock, Water, Low Kick, Superpower, Earth Power, Leech Life, X Scissor, Submission, Brick Break, Giga Drain, Night Slash, Knock Off"
Kangaskhan,,,,"Reversal, Focus Blast, Low Kick, Solar Beam, Earthquake, Hammer Arm, Iron Tail, Dynamic Punch, Aqua Tail, Surf, Crunch, Shadow Ball, Submission, Drain Punch, Brick Break, Rock Slide, Shadow Claw, Sucker Punch, Bubble Beam, Beat Up, Hydro Pump"
Kecleon,,,,"Grass Knot, Low Kick, Solar Beam, Iron Tail, Dynamic Punch, Foul Play, Aqua Tail, Shadow Ball, Brick Break, Drain Punch, Rock Slide, Shadow Claw, Sucker Punch, Knock Off, Shadow Sneak"
Kingler,Water,,,"Water, Superpower, Hammer Arm, High Horsepower, X Scissor, Brick Break, Rock Slide, Stomping Tantrum, Night Slash, Knock Off"
Klawf,Rock,,,"Rock, Reversal, Crabhammer, High Horsepower, Earth Power, Throat Chop, X Scissor, Brick Break, Stomping Tantrum, Shadow Claw, Skitter Smack, Knock Off"
Komala,,,,"Reversal, Low Kick, Superpower, Wood Hammer, Earthquake, Iron Head, Seed Bomb, Brick Break, Rock Slide, Shadow Claw, Sucker Punch, Knock Off, Low Sweep, Payback"
Krookodile,Ground,Dark,,"Ground, Dark, Focus Blast, Grass Knot, Low Kick, Superpower, Stone Edge, Iron Tail, Foul Play, Aqua Tail, Brick Break, Rock Slide, Shadow Claw, Skitter Smack, Low Sweep, Revenge"
Lapras,Water,,,"Water, Megahorn, Solar Beam, Earthquake, Iron Tail, Smart Strike, Drill Run, Body Press, Iron Head, Signal Beam"
Latias,,,,"Grass Knot, Solar Beam, Earthquake, Energy Ball, Surf, Liquidation, Aura Sphere, Shadow Ball, Waterfall, Dive, Shadow Claw, Steel Wing, Sucker Punch"
Lickilicky,,,,"Gyro Ball, Focus Blast, Power Whip, Solar Beam, Hydro Pump, Earthquake, Hammer Arm, Iron Tail, Dynamic Punch, Aqua Tail, Surf, Muddy Water, Body Press, Shadow Ball, Submission, Brick Break, Rock Slide, Stomping Tantrum, Knock Off, Bubble Beam"
